{
  "schema_version": 1,
  "job_id": "request-align-20260925",
  "operation": "recording.align",
  "target_date": "2026-09-25",
  "mode": "execute",
  "requested_by": "assistant",
  "created_at": "2026-09-25T18:00:00Z",
  "timeout_seconds": 1800,
  "params": {
    "transcript_bundle": {
      "root_id": "recordings",
      "relative_path": "2026-09-25/transcripts/recording_transcript_bundle.json"
    }
  }
}
