{
  "schema_version": 1,
  "job_id": "request-resolve-import-20260925",
  "operation": "resolve.import_timeline",
  "target_date": "2026-09-25",
  "mode": "execute",
  "requested_by": "assistant",
  "created_at": "2026-09-25T18:00:00Z",
  "timeout_seconds": 900,
  "params": {
    "reuse_project": false
  }
}
