{
  "schema_version": 1,
  "job_id": "request-resolve-sync-20260925",
  "operation": "resolve.sync_audio",
  "target_date": "2026-09-25",
  "mode": "execute",
  "requested_by": "assistant",
  "created_at": "2026-09-25T18:00:00Z",
  "timeout_seconds": 1800,
  "params": {
    "recordings_root": {
      "root_id": "recordings",
      "relative_path": "2026-09-25/inbox"
    },
    "alignment": {
      "root_id": "repo",
      "relative_path": "scripts/2026-09-25/recording_alignment.json"
    }
  }
}
